,user_doc,type,predict,score
0,the rules of chess (also known as the laws of chess) are rules governing the play of the game of chess.,True,False,16.56919299621208
1,"while the exact origins of chess are unclear, modern rules first took form during the middle ages.",True,False,5.472303614572242
2,"the rules continued to be slightly modified until the early 19th century, when they reached essentially their current form.",True,False,4.7783230988485945
3,the rules also varied somewhat from place to place.,True,False,9.967484419162457
4,"today, the standard rules are set by fide (fédération internationale des échecs), the international governing body for chess.",True,False,6.73880242332717
5,slight modifications are made by some national organizations for their own purposes.,True,False,0.5714285714285714
6,"there are variations of the rules for fast chess, correspondence chess, online chess, and chess960.",True,False,11.015019136521087
7,chess is a two-player board game using a chessboard and sixteen pieces of six types for each player.,True,False,10.082635994862628
8,each type of piece moves in a distinct way.,True,False,13.835601932900962
9,the object of the game is to checkmate (threaten with inescapable capture) the opponent's king.,True,False,9.696040993382994
10,games do not necessarily end in checkmate; players often resign if they believe they will lose.,True,False,9.985487892961666
11,a game can also end in a draw in several ways.,True,True,24.13361182851707
12,"besides the basic moves of the pieces, rules also govern the equipment used, time control, conduct and ethics of players, accommodations for physically challenged players, and recording of moves using chess notation.",True,False,4.866988373065057
13,procedures for resolving irregularities that can occur during a game are provided as well.,True,False,4.916875488299088
14,"== initial setup ==

chess is played on a chessboard, a square board divided into 64 squares (eight-by-eight) of alternating color, which is similar to that used in draughts (checkers) (fide 2008).",True,False,4.009879380758581
15,"no matter what the actual colors of the board, the lighter-colored squares are called ""light"" or ""white"", and the darker-colored squares are called ""dark"" or ""black"".",True,False,7.04159403680454
16,"sixteen ""white"" and sixteen ""black"" pieces are placed on the board at the beginning of the game.",True,False,10.437468342305625
17,the board is placed so that a white square is in each player's near-right corner.,True,False,14.634854978486633
18,horizontal rows are called ranks and vertical rows are called files.,True,False,8.796335605152132
19,"each player controls sixteen pieces:

at the beginning of the game, the pieces are arranged as shown in the diagram: for each side one king, one queen, two rooks, two bishops, two knights, and eight pawns.",True,False,7.886543492975461
20,"the pieces are placed, one on a square, as follows:

the rooks are placed on the outside corners, right and left edge.",True,False,7.757041425040173
21,the knights are placed immediately inside of the rooks.,True,False,18.114404148289136
22,the bishops are placed immediately inside of the knights.,True,False,17.11691937489169
23,the queen is placed on the central square of the same color of that of the player: white queen on the white square and black queen on the black square.,True,False,10.930246359911472
24,the king takes the vacant spot next to the queen.,True,True,23.76784223029794
25,"the pawns are placed one square in front of all of the other pieces.popular mnemonics used to remember the setup are ""queen on her own color"" and ""white on right"".",True,False,7.959590693949274
26,the latter refers to setting up the board so that the square closest to each player's right is white (schiller 2003:16–17).,True,False,9.288427429535018
27,"== gameplay ==

the player controlling the white pieces is named ""white""; the player controlling the black pieces is named ""black"".",True,False,8.854956803174556
28,"white moves first, then players alternate moves.",True,True,41.75561628117711
29,"making a move is required; it is not legal to skip a move, even when having to move is detrimental.",True,False,7.040239996451096
30,"play continues until a king is checkmated, a player resigns, or a draw is declared, as explained below.",True,False,8.156440356234267
31,"in addition, if the game is being played under a time control players who exceed their time limit lose the game.",True,False,11.12818099304437
32,the official chess rules do not include a procedure for determining who plays white.,True,False,12.016983212907139
33,"instead, this decision is left open to tournament-specific rules (e.g.",True,False,8.411592170103274
34,"a swiss system tournament or round-robin tournament) or, in the case of non-competitive play, mutual agreement, in which case some kind of random choice is often employed.",True,False,2.6389994534312238
35,"a common method is for one player to conceal a piece (usually a pawn) of each color in either hand; the other player chooses a hand to open, and receives the color of the piece that is revealed.",True,False,5.7750818028643325
36,"=== movement ===


==== basic moves ====

each type of chess piece has its own method of movement.",True,False,12.699559212938517
37,a piece moves to a vacant square except when capturing an opponent's piece.,True,False,17.728705488779788
38,"except for any move of the knight and castling, pieces cannot jump over other pieces.",True,True,21.864479014506706
39,a piece is captured (or taken) when an attacking enemy piece replaces it on its square (en passant is the only exception).,True,False,7.302446389632481
40,the captured piece is thereby permanently removed from the game.,True,False,14.67455676836627
41,the king can be put in check but cannot be captured (see below).,True,True,30.00440639629514
42,"the king moves exactly one square horizontally, vertically, or diagonally.",True,False,11.13634009583588
43,"a special move with the king known as castling is allowed only once per player, per game (see below).",True,False,14.868258637469669
44,a rook moves any number of vacant squares horizontally or vertically.,True,False,17.302549853163917
45,it also is moved when castling.,True,True,54.57490746676922
46,a bishop moves any number of vacant squares diagonally.,True,True,22.293646114213125
47,"the queen moves any number of vacant squares horizontally, vertically, or diagonally.",True,False,13.119698439542335
48,"a knight moves to the nearest square not on the same rank, file, or diagonal.",True,False,9.683773598808006
49,"(this can be thought of as moving two squares horizontally then one square vertically, or moving one square horizontally then two squares vertically—i.e.",True,False,10.306000299548876
50,"in an ""l"" pattern.)",True,False,0.5
51,the knight is not blocked by other pieces: it jumps to the new location.,True,False,11.719346753495888
52,"pawns have the most complex rules of movement:a pawn moves straight forward one square, if that square is vacant.",True,False,11.805012526420446
53,"if it has not yet moved, a pawn also has the option of moving two squares straight forward, provided both squares are vacant.",True,False,8.37056559155572
54,pawns cannot move backwards.,True,True,50.70899373292923
55,pawns are the only pieces that capture differently from how they move.,True,True,24.83881135162163
56,a pawn can capture an enemy piece on either of the two squares diagonally in front of the pawn (but cannot move to those squares if they are vacant).,True,False,13.808689614132764
57,the pawn is also involved in the two special moves en passant and promotion (schiller 2003:17–19).,True,False,12.065595811769105
58,"==== castling ====

castling consists of moving the king two squares towards a rook, then placing the rook on the other side of the king, adjacent to it.",True,False,10.45028484979579
59,"it is not allowed to move both king and rook in the same time, because ""each move must be played with one hand only."".",True,False,19.632720655935962
60,"castling is only permissible if all of the following conditions hold:
the king and rook involved in castling must not have previously moved;
there must be no pieces between the king and the rook;
the king may not currently be in check, nor may the king pass through or end up in a square that is under attack by an enemy piece (though the rook is permitted to be under attack and to pass over an attacked square);
the castling must be kingside or queenside as shown in the diagram.",True,False,2.6763871720741967
61,"==== en passant ====

when a pawn advances two squares from its original square and ends the turn adjacent to a pawn of the opponent's on the same rank, it may be captured by that pawn of the opponent's, as if it had moved only one square forward.",True,False,5.74855079288609
62,this capture is only legal on the opponent's next move immediately following the first pawn's advance.,True,False,13.148291641192388
63,"the diagrams on the right demonstrate an instance of this: if the white pawn moves from a2 to a4, the black pawn on b4 can capture it en passant, moving from b4 to a3 while the white pawn on a4 is removed from the board.",True,False,4.213279066576005
64,"==== pawn promotion ====

if a player advances a pawn to its eighth rank, the pawn is then promoted (converted) to a queen, rook, bishop, or knight of the same color at the choice of the player (a queen is usually chosen).",True,False,6.608319044218156
65,the choice is not limited to previously captured pieces.,True,False,8.449044634188924
66,"hence it is theoretically possible for a player to have up to nine queens or up to ten rooks, bishops, or knights if all of their pawns are promoted.",True,False,14.48088838972423
67,"if the desired piece is not available, the player must call the arbiter to provide the piece.",True,False,14.259975738311608
68,"=== check ===

a king is in check when it is under attack by at least one enemy piece.",True,False,13.707793173808756
69,a piece unable to move because it would place its own king in check (it is pinned against its own king) may still deliver check to the opposing player.,True,False,7.591246294186413
70,it is illegal to make a move that places or leaves one's king in check.,True,False,13.07328707868688
71,"the possible ways to get out of check are:

move the king to a square where it is not in check.",True,False,16.154883903095552
72,capture the checking piece (possibly with the king).,True,False,14.209045131291662
73,"block the check by placing a piece between the king and the opponent's threatening piece (just 2014), (polgar & truong 2005:32,103), (burgess 2009:550).if it is not possible to get out of check, the king is checkmated and the game is over (see the next section).",True,False,3.242548181688952
74,"in informal games, it is customary to announce ""check"" when making a move that puts the opponent's king in check.",True,False,8.062096960139725
75,"however, in formal competitions check is rarely announced (just 2014).",True,False,7.48242001517337
76,"=== end of the game ===


==== checkmate ====

if a player's king is placed in check and there is no legal move that player can make to escape check, then the king is said to be checkmated, the game ends, and that player loses (schiller 2003:20–21).",True,False,5.65093098682192
77,"unlike other pieces, capturing the opponent's king is not allowed.the diagram shows an example checkmate position.",True,False,8.309164898731337
78,"the white king is threatened by the black queen; the square to which the king could move is also threatened; it cannot capture the queen, because it would then be in check by the rook.",True,False,10.459541599216706
79,"==== resigning ====
either player may resign at any time, conceding the game to their opponent.",True,False,14.66053058930403
80,"a player may resign by saying it verbally or by indicating it on their score sheet in any of three ways: (1) by writing ""resigns"", (2) by circling the result of the game, or (3) by writing ""1–0"" if black resigns or ""0–1"" if white resigns (schiller 2003:21).",True,False,2.175160742662773
81,"tipping over the king also indicates resignation, but it is not frequently used and should be distinguished from accidentally knocking the king over.",True,False,4.340867363057047
82,"stopping both clocks is not an indication of resigning, since clocks can be stopped to call the arbiter.",True,False,8.378927412002698
83,"an offer of a handshake is not necessarily a resignation either, since one player could think they are agreeing to a draw (just 2014).",True,False,6.335345864847854
84,"==== dead position ====

a dead position is defined as a position where neither player can win the game by any sequence of legal moves.",True,False,12.153246235228165
85,any positions with the following pieces only are known as dead positions.,True,True,20.616905351205833
86,"the uscf rules speak of insufficient material for these positions:king against king;
king against king and bishop;
king against king and knight;
king and bishop against king and bishop, with both bishops on squares of the same color (see king and two bishops).",True,False,6.550270247016356
87,"however, insufficient material is not the only condition for a dead position.",True,False,15.318868811641421
88,there are positions where the pieces on the board would be sufficient to mate if arranged otherwise.,True,False,12.326229906815247
89,"see diagram ""example of a dead position"".",True,True,22.538639814089883
90,"==== draws ====

the game ends in a draw if any of these conditions occur:

the game is automatically a draw if the player to move is not in check and has no legal move.",True,False,10.716546774302156
91,this situation is called a stalemate.,True,True,29.860387954856463
92,an example of such a position is shown in the adjacent diagram.,True,False,10.971670993736812
93,the game is immediately drawn for a dead position.,True,True,24.339474569473946
94,both players agree to a draw after one of the players makes such an offer.,True,True,22.615737153498706
95,"the player having the move may claim a draw by declaring that one of the following conditions exists, or by declaring an intention to make a move which will bring about one of these conditions.",True,False,7.5227645225940645
96,"if the claim is proven true, the game is drawn:the same board position has occurred three times with the same player to move and all pieces having the same rights to move, including the right to castle or capture en passant (see threefold repetition rule).",True,False,5.425033996823088
97,"there has been no capture or pawn move in the last fifty moves by each player, if the last move was not a checkmate (see fifty-move rule).",True,False,14.542472790132415
98,"the game ends immediately with a draw by the intervention of the arbiter, without a draw request necessary:
when the same board position has occurred five times (see fivefold repetition rule).",True,False,6.550319601775937
99,"when the moves without capture or pawn move extend up to seventy-five (see seventy-five-move rule).at one time, if a player was able to check the opposing king continually (perpetual check) and the player indicated their intention to do so, the game was drawn.",True,False,4.0319276811033395
100,"this rule is no longer in effect; however, players will usually agree to a draw in such a situation, since either the rule on threefold repetition or the fifty-move rule will eventually be applicable (staunton 1847:21–22), (reinfeld 1954:175).",True,False,4.445399819187747
101,"==== flag-fall ====
a game played under time control will end as a loss for a player who uses up all of their allotted time, which is called flag-fall, unless the opponent cannot possibly checkmate him (see timing).",True,False,6.324490360021591
102,there are different types of time control.,True,True,30.383398096195013
103,players may have a fixed amount of time for the entire game or they may have to make a certain number of moves within a specified time.,True,False,10.993795762646872
104,"also, a small increment of time may be added for each move made.",True,True,21.680170324541944
105,"== competition rules ==
the following rules are the rules used for ""over the board"" (otb) games.",True,False,17.019941987731634
106,"they are defined by the fide laws of chess.. the fide laws of chess define the rules for standard chess, rapid chess, blitz chess and guidelines for chess960.",True,False,7.2166910661409975
107,some rules are specifically adapted for disabled players.,True,False,18.21027410030365
108,"as the rules cover otb play, they cannot be directly applied to computer chess or online chess, played on a computer device.",True,False,5.70555959067384
109,the rules for correspondence chess are defined by the iccf.,True,False,18.53833834188325
110,"=== moving the pieces ===
the movement of pieces is to be done with one hand.",True,True,24.818110365134018
111,"once the hand is taken off a piece after moving it, the move cannot be retracted unless the move is illegal.",True,False,11.239235690405517
112,"when castling, the player should first move the king with one hand and then move the rook with the same hand (schiller 2003:19–20).",True,False,16.060636558245378
113,"in the case of a pawn promotion, if the player releases the pawn on the eighth rank, the player must promote the pawn.",True,False,12.62246523275125
114,"after the pawn has moved, the player may touch any piece not on the board and the promotion is not finalized until the new piece is released on the promotion square (just 2014).",True,False,8.969283808736021
115,"=== touch-move rule ===

in serious play, if a player having the move touches a piece as if having the intention of moving it, then the player must move it if it can be legally moved.",True,False,10.142509717167359
116,"so long as the hand has not left the piece on a new square, any legal move can be made with the piece.",True,False,15.651293657450283
117,if a player touches one of the opponent's pieces then that piece must be captured if there is a legal move that does so.,True,False,13.819458484645507
118,if none of the touched pieces can be moved or captured there is no penalty (schiller 2003:19–20).,True,False,8.537919192461496
119,"when castling, the king must be the first piece touched.",True,True,24.840270158745664
120,"if the player touches the king and a rook, the player must castle with that rook if it is legal to do so.",True,True,21.39663851368806
121,"if the player completes a two-square king move without touching a rook, the player must move the correct rook accordingly if castling in that direction is legal.",True,False,7.936079341252676
122,"if a player starts to castle illegally, another legal king move must be made if possible, including castling with the other rook (schiller 2003:20).",True,False,9.405162628971308
123,"if a player moves a pawn to its eighth rank, it cannot be substituted for a different move of the pawn when the player has stopped touching it.",True,False,11.86030532534306
124,"however, the move is not complete until the promoted piece is released on that square.",True,False,14.217771144849914
125,"if a player wishes to touch a piece with the intention of adjusting its position on a square, the player must first alert the opponent of this intention by saying j'adoube or ""i adjust"".",True,False,5.910730912029237
126,"once the game has started, only the player with the move may touch the pieces on the board (schiller 2003:19–20).",True,False,14.220523329455677
127,"=== timing ===

tournament games are played under time constraints, called time controls, using a chess clock.",True,False,10.461442047425178
128,players must make their moves within the time control or forfeit the game.,True,True,24.177600762981136
129,there are different types of time controls applied.,True,False,19.732459317360604
130,"for standard chess, different periods can be defined with different fixed times (e.g.",True,False,11.163232953738344
131,"first 40 moves in 100 minutes, next 20 moves in 50 minutes, remaining moves in 15 minutes).",True,False,2.6559940299775007
132,"for rapid and blitz chess, only one period can be defined where all moves must be performed.",True,False,7.056988961237626
133,"additionally, an increment or delay per move may be defined.",True,False,8.266821414660562
134,"when a player runs out of time, this event is called flag fall.",True,False,18.360831563178582
135,"a flag fall has no consequences unless stated as observed by the arbiter, in which case the arbiter must intervene, or claimed by a player.",True,False,7.46713233071426
136,"when no flag fall is stated, and one of the following events occur, the result of the game still holds.",True,False,10.09092796593499
137,"it is of no relevance if the player runs out of time afterwards, or has already run out of time, but this was not stated:
if a player delivers a checkmate, the game is over and that player wins.",True,False,9.279140804824173
138,"if a move results in a stalemate, dead position, fivefold repetition or the seventy-five-move rule applies, the game is over and the game is drawn.",True,False,8.845127229224866
139,"if a player claims flag fall and is himself not out of time, then he wins the game if he still theoretically could checkmate the opponent; otherwise the game is a draw.the united states chess federation (uscf) rule is different.",True,False,6.353328580211894
140,"uscf rule 14e defines ""insufficient material to win on time"", that is lone king, king plus knight, king plus bishop, and king plus two knights opposed by no pawns, and there is no forced win in the final position.",True,False,3.9313591618153185
141,"hence to win on time with this material, the uscf rule requires that a win can be forced from that position, while the fide rule merely requires a win to be possible.",True,False,8.30064471796031
142,(see monika soćko rules appeal in 2008 and women's world chess championship 2008 for a famous instance of this rule.),True,False,5.367512219745711
143,"with mechanical clocks only, flag fall for both players can occur.",True,False,17.618495098489483
144,"with digital clocks, the clock indicates which flag fell first, and this information is valid.",True,False,7.033307470987995
145,"if a flag fall is stated, and as can happen with mechanical clocks only, the flag fall happened for both players, then:if it can be established which player ran out of time first, the rules apply for flag fall for one player only.",True,False,6.887991186639681
146,"otherwise, the result is a draw, unless this is a standard chess game which is not in the last period, here the play will be resumed.in the last period of a standard chess game or rapid games, if played without increment, a special set of rules applies regarding the clock, referenced as ""quickplay finishes"".",True,False,4.016453676056444
147,"these rules allow a player with under two minutes time to request an increment introduced, or request a draw based on claiming no progress or no effort, to be ruled by the arbiter.",True,False,4.845607013825102
148,"these rules have been relevant when playing with mechanical clocks, which do not allow setting an increment and are today with digital clocks of second importance only, as playing with increment is recommended.",True,False,3.08992792370458
149,"=== recording moves ===

each square of the chessboard is identified with a unique pair of a letter and a number.",True,False,4.807829377644568
150,"the vertical files are labeled a through h, from white's left (i.e.",True,False,6.578112753112141
151,the queenside) to white's right.,True,True,24.633552972241723
152,"similarly, the horizontal ranks are numbered from 1 to 8, starting from the one nearest white's side of the board.",True,False,4.914209676308077
153,"each square of the board, then, is uniquely identified by its file letter and rank number.",True,False,8.467515091548812
154,"the white king, for example, starts the game on square e1.",True,False,15.041649343849876
155,the black knight on b8 can move to a6 or c6.,True,False,7.801349239689963
156,"in formal competition, each player is obliged to record each move as it is played in a chess notation in order to settle disputes about illegal positions, overstepping time control, and making claims of draws by the fifty-move rule or repetition of position.",True,False,4.157917720517093
157,algebraic chess notation is the accepted standard for recording games today.,True,False,10.537058474500004
158,there are other systems such as iccf numeric notation for international correspondence chess and the obsolete descriptive chess notation.,True,False,5.980953731215918
159,"the current rule is that a move must be made on the board before it is written on paper or recorded with an electronic device.both players should indicate offers of a draw by writing ""="" at that move on their score sheet (schiller 2003:27).",True,False,3.5511934607942823
160,notations about the time on the clocks can be made.,True,True,41.759402636434146
161,"if a player has less than five minutes left to complete all of their moves, they are not required to record the moves (unless a delay of at least thirty seconds per move is being used).",True,False,4.435511700121009
162,the score sheet must be made available to the arbiter at all times.,True,False,12.509059131145477
163,a player may respond to an opponent's move before writing it down (schiller 2003:25–26).,True,False,14.923015912432906
164,"=== adjournment ===
see adjournment § chess.",True,True,27.242614221753563
165,"=== irregularities ===


==== illegal move ====
a player who makes an illegal move must retract that move and make a legal move.",True,False,14.851670822584444
