,user_doc,type,predict,score
166,"that move must be made with the same piece if possible, because the touch-move rule applies.",True,False,23.129421462989903
167,"if the illegal move was an attempt to castle, the touch-move rule applies to the king but not to the rook.",True,False,18.16545253560954
168,the arbiter should adjust the time on the clock according to the best evidence.,True,False,14.039613537186973
169,"if the mistake is only noticed later on, the game should be restarted from the position in which the error occurred.",True,False,12.502482891643544
170,some regional organizations have different rules.a player may correct an illegal move if the player has not pressed their clock.,True,False,17.7368386256375
171,"if a player has pressed their clock, the illegal move may be stated by the arbiter intervening or by the opponent claiming the illegal move.",True,False,19.383341333001923
172,"if the arbiter does not intervenes and the opponent moves, the illegal move is accepted and without penalty.according to the fide laws of chess, the first stated completed illegal move results in a time penalty.",True,False,23.387202382897065
173,"the time penalty consists of giving the opponent two minutes extra time in standard and rapid chess, one minute extra time in blitz.",True,False,22.858214955683156
174,"the second stated completed illegal move by the same player results in the loss of the game, unless the position is such that it is impossible for the opponent to win by any series of legal moves (e.g.",True,False,23.25978266552924
175,if the opponent has a bare king) in which case the game is drawn.,True,False,25.697724133167533
176,a move is completed when it has been made and the player has pressed the clock.,True,False,24.470696658331306
177,"==== illegal position ====
if it is discovered during the game that the starting position was incorrect, the game is restarted.",True,False,18.575087076553434
178,"if it is discovered during the game that the board is oriented incorrectly, the game is continued with the pieces transferred to a correctly oriented board.",True,False,18.478723647852192
179,"if the game starts with colours reversed, the game is restarted if less than 10 moves have been made by both players, otherwise the game is continued.",True,False,18.723891357579607
180,"some regional organizations have different rules.if a player knocks over pieces, it is their responsibility to restore them to their correct position on their time.",True,False,17.596642815035555
181,"if it is discovered that an illegal move has been made, or that pieces have been displaced, the game is restored to the position before the irregularity.",True,False,17.337836954132644
182,"if that position cannot be determined, the game is restored to the last known correct position.",True,False,19.57194628506341
183,"=== conduct ===
players may not use any notes, outside sources of information (including computers), or advice from other people.",True,False,13.624679627039422
184,analysis on another board is not permitted.,True,False,18.226328797629492
185,"scoresheets are to record objective facts about the game only, such as time on the clock or draw offers.",True,False,16.972755339428684
186,players may not leave the competition area without permission of the arbiter (schiller 2003:30–31).,True,False,16.97286752518465
187,high standards of etiquette and ethics are expected.,True,False,8.920093404150522
188,players should shake hands before and after the game.,True,True,36.4377122426412
189,"generally a player should not speak during the game, except to offer a draw, resign, or to call attention to an irregularity.",True,False,15.89788448481252
190,"an announcement of ""check"" is commonly made in informal games but is not recommended in officially sanctioned games.",True,False,15.605228103273038
191,"a player may not distract or annoy another player by any means, including repeatedly offering a draw (schiller 2003:30–31,49–52).",True,False,17.238823240796652
192,"due to increasing concerns about the use of chess engines and outside communication, mobile phone usage is banned.",True,False,12.662632839496103
193,"the first forfeit by a high-profile player, for their phone ringing during play, occurred in 2003. in 2014 fide extended this to ban all mobile phones from the playing area during chess competitions, under penalty of forfeiture of the game or even expulsion from the tournament.",True,False,10.786021747969375
194,"however, the rules also allow for less rigid enforcement in amateur events.",True,False,10.517063541102615
195,"== equipment ==

the size of the squares of the chessboard should be approximately 1.25 to 1.3 times the diameter of the base of the king, or 50 to 65 mm.",True,False,16.387218177122637
196,squares of approximately 57 mm (​2 1⁄4 inches) normally are well-suited for pieces with the kings in the preferred size range.,True,False,16.411666273301684
197,the darker squares are usually brown or green and the lighter squares are off-white or buff.,True,False,13.197059274508412
198,pieces of the staunton chess set design are the standard and are usually made of wood or plastic.,True,False,17.42020082821755
199,"they are often black and white; other colors may be used (like a dark wood or even red for the dark pieces) but they would still be called the ""white"" and ""black"" pieces (see white and black in chess).",True,False,25.964564036646905
200,the height of the king should be 85 to 105 millimetres (3.35–4.13 inches).,True,False,8.077690818768005
201,a height of approximately 95 to 102 mm (​3 3⁄4–4 inches) is preferred by most players.,True,False,11.000337812979536
202,the diameter of the king should be 40 to 50% of its height.,True,False,8.865256888281108
203,the size of the other pieces should be in proportion to the king.,True,False,21.832618995280548
204,"the pieces should be well balanced (just 2014).in games subject to time control, a chess clock is used, consisting of two adjacent clocks and buttons to stop one clock while starting the other, such that the two component clocks never run simultaneously.",True,True,31.877882481030777
205,the clock can be analog or digital though a digital clock is highly preferred under both uscf and fide rulesets.,True,False,15.060990094134086
206,this is since most tournaments now include either an increment (extra time being added prior or after the move) or delay (a countdown to when a clock starts again) to their time controls.,True,False,18.99499514065845
207,"before the start of the game, either the arbiter decides, or whoever is playing black, where the chess clock is placed.",True,False,19.940547295176415
208,"== history ==
the rules of chess have evolved much over the centuries from the early chess-like games played in india in the 6th century.",True,False,19.748553835662175
209,for much of that time the rules have varied from area to area.,True,False,29.490900454057627
210,"the modern rules first took form in italy during the 13th century, giving more mobility to pieces that previously had more restricted movement (such as the queen and bishop).",True,False,20.552190204511845
211,"such modified rules entered into an accepted form during the late 15th century (hooper & whyld 1992:41,328) or early 16th century (ruch 2004).",True,False,20.483906610607438
212,"the basic moves of the king, rook, and knight are unchanged.",True,False,20.82821113751093
213,pawns originally did not have the option of moving two squares on their first move and promoted only to a queen if they reached the eighth rank.,True,False,16.816249013119148
214,"the queen was originally the fers or farzin, which could move one square diagonally in any direction.",True,False,13.23565961827792
215,"in european chess it became able to leap two squares diagonally, forwards, backwards, or to left or right on its first move; some areas also gave this right to a newly promoted pawn.",True,False,22.248709927218403
216,"in the persian and arabic game the bishop was a pīl (persian) or fīl (arabic) (meaning ""elephant"") which moved two squares diagonally with jump (davidson 1949:13).",True,False,21.66031337419332
217,in the middle ages the pawn could only be promoted to the equivalent of a queen (which at that time was the weakest piece) if it reached its eighth rank (davidson 1949:59–61).,True,False,19.675722922322198
218,"during the 12th century the squares on the board sometimes alternated colors, and this became the standard in the 13th century (davidson 1949:146); whence the word ""chequered""/""checkered"".",True,False,18.302329418422097
219,between 1200 and 1600 several laws emerged that drastically altered the game.,True,False,13.629206062439563
220,checkmate became a requirement to win; a player could not win by capturing all of the opponent's pieces.,True,False,22.01140611187316
221,"stalemate was added, although the outcome has changed several times (see history of the stalemate rule).",True,False,19.622910071346553
222,"pawns gained the option of moving two squares on their first move, and the en passant rule was a natural consequence of that new option.",True,False,19.887744964583465
223,the king and rook acquired the right to castle (see variations throughout history of castling for different versions of the rule).,True,False,21.76904916711504
224,"between 1475 and 1500 the queen and the bishop also acquired their current moves, which made them much stronger pieces (davidson 1949:14–17).",True,False,14.688933435757473
225,when all of these changes were accepted the game was in essentially its modern form (davidson 1949:14–17).,True,False,13.009662139661009
226,the rules for pawn promotion have changed several times.,True,False,29.448371170906707
227,"as stated above, originally the pawn could only be promoted to the queen, which at that time was a weak piece.",True,False,18.95618151967252
228,"when the queen acquired its current move and became the most powerful piece, the pawn could then be promoted to a queen or a rook, bishop, or knight.",True,False,21.41588239226703
229,"in the 18th century rules allowed only the promotion to a piece already captured, e.g.",True,False,18.951802473861267
230,the rules published in 1749 by françois-andré danican philidor.,True,False,16.36020613796537
231,"in the 19th century this restriction was lifted, which allowed for a player to have more than one queen, e.g.",True,False,16.26287051832853
232,the 1828 rules by jacob sarratt (davidson 1949:59–61).,True,False,12.166586234603196
233,"two new rules concerning draws were introduced, each of which have changed through the years:

the threefold repetition rule was added, although at some times up to six repetitions have been required, and the exact conditions have been specified more clearly (see threefold repetition#history).",True,True,31.228244488065425
234,the fifty-move rule was also added.,True,False,28.053107888764632
235,"at various times, the number of moves required was different, such as 24, 60, 70, or 75. for several years in the 20th century, the standard fifty moves was extended to one hundred moves for a few specific endgames (see fifty-move rule's history).another group of new laws included (1) the touch-move rule and the accompanying ""j'adoube/adjust"" rule; (2) that white moves first (in 1889); (3) the orientation of the board; (4) the procedure if an illegal move was made; (5) the procedure if the king had been left in check for some moves; and (6) issues regarding the behavior of players and spectators.",True,True,98.79565354047693
236,the staunton chess set was introduced in 1849 and it became the standard style of pieces.,True,False,17.577662073169144
237,"the size of pieces and squares of the board was standardized (hooper & whyld 1992:220–21, laws, history of).",True,False,20.171455287760857
238,"until the middle of the 19th century, chess games were played without any time limit.",True,False,23.058176395967205
239,"in an 1834 match between alexander mcdonnell and louis-charles mahé de la bourdonnais, mcdonnell took an inordinate amount of time to move, sometimes up to 1½ hours.",True,False,14.904005206236564
240,"in 1836 pierre charles fournier de saint-amant suggested a time limit, but no action was taken.",True,False,11.938740415296843
241,"at the 1851 london tournament, staunton blamed his loss in his match against elijah williams  on williams' slow play; one game was adjourned for the day after only 29 moves.",True,False,20.45946959864206
242,the next year a match between daniel harrwitz and johann löwenthal used a limit of 20 minutes per move.,True,False,11.96486608608074
243,the first use of a modern-style time limit was in an 1861 match between adolph anderssen and ignác kolisch (sunnucks 1970:459).,True,False,14.418971745576984
244,"=== codification ===

the first known publication of chess rules was in a book by luis ramírez de lucena about 1497, shortly after the movement of the queen, bishop, and pawn were changed to their modern form (just 2014).",True,False,28.16945023877292
245,ruy lópez de segura gave rules of chess in his 1561 book libro de la invencion liberal y arte del juego del axedrez (sunnucks 1970:294).,True,False,24.119604157434424
246,"in the 16th and 17th centuries, there were local differences concerning rules such as castling, pawn promotion, stalemate, and en passant.",True,False,19.886027529328427
247,some of these differences persisted until the 19th century (harkness 1967:3); for example differences in castling rules persisted in italy until the late 19th century.,True,False,20.62830189204504
248,"as chess clubs arose and tournaments became common, there was a need to formalize the rules.",True,False,14.763630525048386
249,"in 1749 philidor (1726–1795) wrote a set of rules that were widely used, as well as rules by later writers such as the 1828 rules by jacob sarratt (1772–1819) and rules by george walker (1803–1879).",True,False,26.211940659253674
250,"in the 19th century, many major clubs published their own rules, including the hague in 1803, london in 1807, paris in 1836, and st. petersburg in 1854. in 1851 howard staunton (1810–1874) called for a ""constituent assembly for remodeling the laws of chess"" and proposals by tassilo von heydebrand und der lasa (1818–1889) were published in 1854. staunton had published rules in chess player's handbook in 1847, and his new proposals were published in 1860 in chess praxis; they were generally accepted in english-speaking countries.",True,True,31.574634531129952
251,"german-speaking countries usually used the writings of chess authority johann berger (1845–1933) or handbuch des schachspiels by paul rudolf von bilguer (1815–1840), first published in 1843.
in 1924, fédération internationale des échecs (fide) was formed and in 1929 it took up the task of standardizing the rules.",True,False,11.337575878122243
252,"at first fide tried to establish a universal set of rules, but translations to various languages differed slightly.",True,False,14.098712479894749
253,"although fide rules were used for international competition under their control, some countries continued to use their own rules internally (hooper & whyld 1992:220–21).",True,False,21.578657400533586
254,in 1952 fide created the permanent commission for the rules of chess (also known as the rules commission) and published a new edition of the rules.,True,False,23.142685936027927
255,"the third official edition of the laws was published in 1966. the first three editions of the rules were published in french, with that as the official version.",True,False,20.186122042327305
256,in 1974 fide published the english version of the rules (which was based on an authorized 1955 translation).,True,False,15.089699797273454
257,"with that edition, english became the official language of the rules.",True,False,19.021336027309385
258,"another edition was published in 1979. throughout this time, ambiguities in the laws were handled by frequent interpretations that the rules commission published as supplements and amendments.",True,False,20.35473824416259
259,in 1982 the rules commission rewrote the laws to incorporate the interpretations and amendments (fide 1989:7–8).,True,False,14.652987083143174
260,"in 1984 fide abandoned the idea of a universal set of laws, although fide rules are the standard for high-level play (hooper & whyld 1992:220–21).",True,False,22.184889670058293
261,"with the 1984 edition, fide implemented a four-year moratorium between changes to the rules.",True,False,13.929657781684895
262,"other editions were issued in 1988 and 1992 (fide 1989:5), (just 2014).",True,False,14.99233666480191
263,"the rules of national fide affiliates (such as the united states chess federation, or uscf) are based on the fide rules, with slight variations (just 2014).",True,False,23.237892666904276
264,"kenneth harkness published popular rulebooks in the united states starting in 1956, and the uscf continues to publish rulebooks for use in tournaments it sanctions.",True,False,19.021399443638195
265,"in 2008, fide added the variant chess960 to the appendix of the ""laws of chess"".",True,False,18.075783123741264
266,"chess960 uses a random initial set-up of main pieces, with the conditions that the king is placed somewhere between the two rooks, and bishops on opposite-color squares.",True,False,19.25792653894833
267,"the castling rules are extended to cover all these positions.in the 21st century, rules about such things as mobile phones and unauthorised use of chess engines were introduced.",True,False,21.532239174862323
268,"== variations ==
from time to time, rules have been introduced at certain tournaments to discourage players from agreeing to short draws.",True,False,19.91135301330538
269,"one such case was the ""no drawing or resigning during the first 30 moves"" rule used at the 2009 london chess classic.",True,False,16.55929376070198
270,"== see also ==

specific rules


== notes ==


== references ==
burgess, graham (2009), the mammoth book of chess (3rd ed.",True,False,14.855853855826629
271,"), running press, isbn 978-0-7624-3726-9
davidson, henry (1949), a short history of chess (1981 ed.",True,False,15.822174969019727
272,"), mckay, isbn 0-679-14550-8
fide (1989), the official laws of chess, macmillan, isbn 0-02-028540-x
fide (2008), fide laws of chess, fide, isbn 978-0-9594355-2-8, retrieved 2008-09-10
harkness, kenneth (1967), official chess handbook, mckay
hooper, david; whyld, kenneth (1996) [first pub.",True,True,54.00544938356335
273,"1992], the oxford companion to chess (2nd ed.",True,False,10.712009185966666
274,"), oxford university press, isbn 0-19-280049-3
just, tim (2014), u.s. chess federation's official rules of chess (6th ed.",True,False,23.39188393157677
275,"), mckay, isbn 978-0-8129-3559-2
polgar, susan; truong, paul (2005), a world champion's guide to chess, random house, isbn 978-0-8129-3653-7
reinfeld, fred (1954), how to be a winner at chess, fawcett, isbn 0-449-91206-x
ruch, eric (2004), the italian rules, iccf, retrieved 2008-09-10
schiller, eric (2003), official rules of chess (2nd ed.",True,True,65.22725790257518
276,"), cardoza, isbn 978-1-58042-092-1
staunton, howard (1847), the chess-player's handbook, london: h. g. bohn, pp.",True,False,16.014402625456526
277,"21–22, isbn 0-7134-5056-8 (1985 batsford reprint, isbn 1-85958-005-x)
sunnucks, anne (1970), the encyclopaedia of chess, st. martin's press (2nd ed.",True,False,23.47419736523887
278,"), isbn 978-0-7091-4697-1
timman, jan (2005), curaçao 1962: the battle of minds that shook the chess world, new in chess, isbn 978-90-5691-139-3


== further reading ==
golombek, harry, ed.",True,False,25.500052858547576
279,"(1976), the laws of chess and their interpretations, pitman, isbn 0-273-00119-1
golombek, harry (1977), golombek's encyclopedia of chess, crown publishing, isbn 0-517-53146-1
harkness, kenneth (1970), official chess rulebook, mckay, isbn 0-679-13028-4


== external links ==
fide laws of chess
fide standards of chess equipment, venue for fide tournaments, rate of play and tie-break regulations
uscf learn to play chess
uscf clock rules",True,True,87.42609919667208
280,the grand mansion gate (chinese: 大宅门) is a 2001 chinese historical television series written and directed by guo baochang.,False,False,0.019417475728155338
281,guo is also the author of the original novel of the same name.,False,False,0.4444444444444444
282,"the television series stars siqin gaowa, chen baoguo, liu peiqi, du yulu, he saifei, jiang wenli, and zhang fengyi.",False,False,0.05925925925925926
283,prominent chinese directors zhang yimou and chen kaige also make cameo appearances.,False,False,0.997202518913481
284,guo baochang spent over 40 years writing the script for film.,False,False,1.3698454695088522
285,"guo had sole discretion with the early script, and eventually wrote approximately 4 drafts.",False,False,0.24074074074074073
286,"the television series began production in 2000 and finished filming in 2001. a second season was completed in 2003.
the grand mansion gate details the story of the rise and fall of the time-honored brand baicao hall and the frustrations and fates of three generations of the bai family.the series premiered on cctv-1 in mainland china on 15 april 2001 and in hong kong on june 4.",False,False,0.1236988770932615
287,"== synopsis ==
in 1880 during the 6th year of the guangxu period of the qing dynasty, bai jingqi (chen baoguo) is born into the baicao hall, a prominent merchant family in beijing.",False,False,0.031746031746031744
288,the first season chronicles the lives of bai jingqi's predecessors in the late qing and early republic of china before focusing on bai jingqi when he becomes the new family patriarch.,False,False,1.0442009189885533
289,the subsequent season details his later life after the second sino-japanese war through to the establishment of the people's republic of china.,False,False,1.1957544080622784
290,"== cast ==


=== main ===
chen baoguo as bai jingqi (白景琦), liu cihang and wang cihang portray bai jingqi as a child.the series' main protagonist, patriarch and head of the baicao hall.",False,False,0.04048582995951417
291,"born to bai yingxuan and his wife wen shi, jingqi never once cried in his childhood years, and was branded by his uncle bai yingyu as an unlucky omen.",False,False,0.0728476821192053
292,he succeeded his mother as the head of the baicao hall.,False,False,0.07142857142857142
293,"notoriously hot-tempered, jingqi maintains a strict grip on the family and its influence as years of revolution and instability plaguing china in the late 19th to mid-20th century tests the prestige of his time-honored family name.he saifei as yang jiuhong (杨九红).one of bai jingqi's concubines, who was formerly a prostitute.",False,False,0.4122751340015949
294,"yang's status as a former prostitute results in years of disdain and abuse by the bai family, notably from jingqi's mother, bai wen shi.",False,False,1.7163855675856272
295,"the series marks the second time he and zhang yimou are working together, having worked together ten years prior on the set of his film raise the red lantern, where she played a similar character of low-social status struggling against members of a wealthy household.xie lan as li xiangxiu (李香秀).bai jingqi's second wife, originally a servant girl sold to the bai family by her parents.",False,False,0.43087038810650047
296,"her years as a servant girl allowed her to see the bitter rivalries surrounding jingqi and his concubines, which she uses to her advantage.",False,False,0.09259259259259259
297,"she begins an affair with bai jingqi and uses his favor to maneuver her way into becoming his second wife, thus granting her a higher title and status, notably over yang jiuhong, whose relentless bullying and abuse of another concubine resulted in the latter committing suicide.siqin gaowa as mrs. bai (bai wen shi) (白文氏).bai jingqi's mother and his predecessor as head of the bai family.",False,False,0.12238191497390685
298,"her role was aggressively challenged by wealthy patriarchs, including her own brother-in-law bai yingyu, but upon successfully defending the family's secret medicinal formula from scheming entrepreneurs, she became the unquestioned matriarch of the baicao hall.",False,False,0.6022046693888577
299,"she maintained the assets, wealth and prestige of the family, amassing influence by currying favor with imperial eunuchs of the qing court, and outmaneuvering members of the manchu nobility.liu peiqi as bai yingyu (白颖宇).bai jingqi's uncle, spoiled in his childhood by his mother and overprotected in adulthood by his eldest brother, bai yingyu was a thrifty spender who rarely cared about the devastating effects brought to the bai family.",False,False,0.09357021282601162
300,"he became an entrepreneur, sponsoring brothels and fought bitterly against his sister-in-law wen shi, plotting to steal the family's secret medicinal formula to drive the baicao hall out of business, and taking her son jingqi to a brothel when he was a child.",False,False,0.29124795486314375
301,"=== the bai family ===
du yulu as bai mengtang (白萌堂), bai jingqi's paternal grandfather, the head of the baicao hall at the start of the series.",False,False,0.9393622930844625
302,"wang liyuan as mrs. bai (bai zhou shi) (白周氏), bai jingqi's paternal grandmother.",False,False,0.9667396525090391
303,"li hongtao as bai yingyuan (白颖园), bai mengtang's eldest son.",False,False,1.6994922532225556
304,"zhao lingqi as mrs. bai (bai yin shi) (白殷氏), bai yingyuan's wife.",False,False,1.1609745256106059
305,"bi yanjun as bai yingxuan (白颖轩), bai mengtang's second son and bai jingqi's father.",False,False,1.7242195924909989
306,"liu peiqi as bai yingyu (白颖宇), bai mengtang's youngest son.",False,False,1.605152630581046
