,user_doc,type,predict,score
307,"zhang yan as mrs. bai (bai fang shi) (白方氏), bai yingyu's wife.",False,False,1.1343078589439393
308,"li ping as bai yaping (白雅萍), bai mengtang's youngest child and only daughter.",False,False,1.3917670221999288
309,"jia xinguang as bai jingyi (白景怡), bai yingyuan's eldest son.",False,False,1.605152630581046
310,"shang ying as wu cuigu (乌翠姑), bai jingyi's wife.",False,False,1.9334793050180783
311,xu boping as young bai jingyi.,False,False,0.0
312,"cheng xiangyin as bai jingshuang (白景双), bai yingyu's eldest son.",False,False,1.605152630581046
313,"ai liya as bai yufen (白玉芬), bai yingyuan's daughter.",False,False,2.0249555679254754
314,geng sisi as young bai yufen.,False,False,0.0
315,"li shusheng as bai jingsi (白景泗), bai yingyuan's second son.",False,False,1.7183601777508575
316,wu jianing as young bai jingsi.,False,False,0.0
317,"liu chao as bai jingwu (白景武), bai yingyu's second son.",False,False,1.6240205551093478
318,wang chaoqun as young bai jingwu.,False,False,0.0
319,"li xiaolei as bai jinglu (白景陆), bai yingyuan's third son.",False,False,2.0947230097859406
320,chen weiyou as young bai jinglu.,False,False,0.0
321,"ru ping as huang chun (黄春), bai jingqi's wife.",False,False,2.024388395927169
322,chen lingyue as young huang chun.,False,False,0.0
323,"lei juan as huai hua (槐花), bai jingqi's second concubine and a former servant girl.",False,False,1.0918583041661745
324,"jiang wenli as bai yuting (白玉婷), bai yingxuan's youngest daughter.",False,False,1.5674167815244422
325,ma sichun as young bai yuting.,False,False,0.35714285714285715
326,"ji baozhong as bai jingsheng (白敬生), bai jingyi's eldest son.",False,False,1.605152630581046
327,"zhao yi as bai jingye (白敬业), bai jingqi and huang chun's eldest son.",False,False,1.1456985450104664
328,"zhang yang as bai jinggong (白敬功), bai jingqi and huang chun's second son.",False,False,1.1325406502736242
329,"zhang dinghan as bai jiali (白佳莉), bai jingqi and yang jiuhong's daughter.",False,False,1.2980170221999288
330,"liu lingzhi as bai zhanyuan (白占元), bai jingqi's grandson and bai jingye's eldest son.",False,False,1.6648136518969394
331,"=== supporting ===
zhang fengyi as ji zengbu (季宗布), bai jingqi's teacher and a military officer in the royal guard divine engine division.",False,False,0.5596913777683911
332,"zheng had worked alongside many of the main and supporting cast members, notably siqin gaowa and chen kaige.",False,False,0.09090909090909091
333,yu rongguang as bai hua.,False,False,0.0
334,"li xuejian as master yu (于八爷), a drug dealer in beijing.",False,False,0.14285714285714285
335,"lei kesheng as wang xiguang (王喜光), an imperial eunuch.",False,False,0.0
336,yuan zi as young wang xiguang.,False,False,0.14285714285714285
337,"ning jing as zhen'er (珍儿), madam of the brothel yang jiuhong worked at.",False,False,0.09090909090909091
338,"zhang yimou as li lianying, an imperial eunuch of the empress dowager.",False,False,0.14285714285714285
339,chen kaige as an official in the local government.,False,False,3.2087361344269345
340,"he qun as pitou'er (皮头儿), a worker at a pawnshop.",False,False,0.0
341,"tian zhuangzhuang as taki (田木), a japanese military officer.",False,False,0.0
342,"== production ==


=== conception and development ===
in 1959 at the age of 19, guo baochang entered beijing film academy and began to write the novel the grand mansion gate.",False,False,0.06470588235294118
343,"at the dawn of the cultural revolution, he was labeled as a ""reactionary student"" and was sent to nankou farm of beijing to reform through labor.",False,False,0.1262135922330097
344,"in order to avoid the attention of the red guards, he burned the original manuscript.",False,False,0.22857142857142856
345,in march 1969 he rewrote the novel.,False,False,0.1111111111111111
346,in 1980 he divorced his wife and the novel was burned by the furious woman.,False,False,0.17142857142857143
347,"at the end of 1994, he rewrote the novel for the third and final time.baicao hall (百草厅) took inspiration from tong ren tang, one of the time-honored pharmaceutical companies in china founded at the beginning of the qing dynasty and which has lasted for almost 350 years.",False,False,0.22510232295479662
348,guo baochang himself had lived there for more than 26 years.,False,False,0.35714285714285715
349,"the main character bai jingqi was inspired by yue jingyu (乐镜宇), guo baochang's foster father and founder of the hong ji tang pharmaceutical company.",False,False,0.4357564087119399
350,"the characters bai yuting and li xiangxiu were inspired by guo's twelfth aunt and a concubine of yue jingyu's, respectively.",False,False,1.4842896511999226
351,"=== casting ===
directors zhang yimou, chen kaige, he qun and tian zhuangzhuang joined the cast.",False,False,0.06153846153846154
352,"actors yu rongguang, li xuejian, ning jing and lei kesheng were cast in supporting roles for the series.",False,False,0.15555555555555556
353,"=== filming ===
principal photography started in 2000 and wrapped in 2001.",False,False,0.037037037037037035
354,"== music ==


== broadcast ==
the grand mansion gate was broadcast in mainland china in april 2001 and two months later was aired in hong kong.",False,False,0.08
355,"== references ==


== external links ==
the grand mansion gate on imdb
the grand mansion gate at douban (in chinese)
the grand mansion gate at the mtime.com (in chinese)",False,False,0.04912537499817403
