,user_doc,type,predict,score
166,"that move must be made with the same piece if possible, because the touch-move rule applies.",True,False,18.18133674774851
167,"if the illegal move was an attempt to castle, the touch-move rule applies to the king but not to the rook.",True,False,9.882443252608189
168,the arbiter should adjust the time on the clock according to the best evidence.,True,False,9.279079803773092
169,"if the mistake is only noticed later on, the game should be restarted from the position in which the error occurred.",True,False,5.116217185081919
170,some regional organizations have different rules.a player may correct an illegal move if the player has not pressed their clock.,True,False,8.637221941408121
171,"if a player has pressed their clock, the illegal move may be stated by the arbiter intervening or by the opponent claiming the illegal move.",True,False,10.199928910102484
172,"if the arbiter does not intervenes and the opponent moves, the illegal move is accepted and without penalty.according to the fide laws of chess, the first stated completed illegal move results in a time penalty.",True,False,6.315429236219832
173,"the time penalty consists of giving the opponent two minutes extra time in standard and rapid chess, one minute extra time in blitz.",True,False,6.063217027625137
174,"the second stated completed illegal move by the same player results in the loss of the game, unless the position is such that it is impossible for the opponent to win by any series of legal moves (e.g.",True,False,6.126038704737853
175,if the opponent has a bare king) in which case the game is drawn.,True,False,16.53815096541043
176,a move is completed when it has been made and the player has pressed the clock.,True,True,22.141564531887056
177,"==== illegal position ====
if it is discovered during the game that the starting position was incorrect, the game is restarted.",True,False,7.899180704584489
178,"if it is discovered during the game that the board is oriented incorrectly, the game is continued with the pieces transferred to a correctly oriented board.",True,False,6.111130235554575
179,"if the game starts with colours reversed, the game is restarted if less than 10 moves have been made by both players, otherwise the game is continued.",True,False,7.217506949453311
180,"some regional organizations have different rules.if a player knocks over pieces, it is their responsibility to restore them to their correct position on their time.",True,False,6.0750823984565825
181,"if it is discovered that an illegal move has been made, or that pieces have been displaced, the game is restored to the position before the irregularity.",True,False,9.263201719686128
182,"if that position cannot be determined, the game is restored to the last known correct position.",True,False,11.037394452614846
183,"=== conduct ===
players may not use any notes, outside sources of information (including computers), or advice from other people.",True,False,3.9310361133778966
184,analysis on another board is not permitted.,True,False,16.460153255607196
185,"scoresheets are to record objective facts about the game only, such as time on the clock or draw offers.",True,False,8.422144451597884
186,players may not leave the competition area without permission of the arbiter (schiller 2003:30–31).,True,False,9.943358755275346
187,high standards of etiquette and ethics are expected.,True,False,6.990689094577517
188,players should shake hands before and after the game.,True,True,29.760959953497995
189,"generally a player should not speak during the game, except to offer a draw, resign, or to call attention to an irregularity.",True,False,7.40534265948562
190,"an announcement of ""check"" is commonly made in informal games but is not recommended in officially sanctioned games.",True,False,5.682302647547675
191,"a player may not distract or annoy another player by any means, including repeatedly offering a draw (schiller 2003:30–31,49–52).",True,False,7.435762908837008
192,"due to increasing concerns about the use of chess engines and outside communication, mobile phone usage is banned.",True,False,2.6998891312949427
193,"the first forfeit by a high-profile player, for their phone ringing during play, occurred in 2003. in 2014 fide extended this to ban all mobile phones from the playing area during chess competitions, under penalty of forfeiture of the game or even expulsion from the tournament.",True,False,2.49953466555933
194,"however, the rules also allow for less rigid enforcement in amateur events.",True,False,5.047193922437445
195,"== equipment ==

the size of the squares of the chessboard should be approximately 1.25 to 1.3 times the diameter of the base of the king, or 50 to 65 mm.",True,False,2.949566026214197
196,squares of approximately 57 mm (​2 1⁄4 inches) normally are well-suited for pieces with the kings in the preferred size range.,True,False,2.7677132980857637
197,the darker squares are usually brown or green and the lighter squares are off-white or buff.,True,False,5.692268128307762
198,pieces of the staunton chess set design are the standard and are usually made of wood or plastic.,True,False,10.647814615879556
199,"they are often black and white; other colors may be used (like a dark wood or even red for the dark pieces) but they would still be called the ""white"" and ""black"" pieces (see white and black in chess).",True,False,6.6739255267998265
200,the height of the king should be 85 to 105 millimetres (3.35–4.13 inches).,True,False,3.210681778472324
201,a height of approximately 95 to 102 mm (​3 3⁄4–4 inches) is preferred by most players.,True,False,2.8216025917618364
202,the diameter of the king should be 40 to 50% of its height.,True,False,5.713676397289548
203,the size of the other pieces should be in proportion to the king.,True,False,17.741040962038255
204,"the pieces should be well balanced (just 2014).in games subject to time control, a chess clock is used, consisting of two adjacent clocks and buttons to stop one clock while starting the other, such that the two component clocks never run simultaneously.",True,False,3.656997036585904
205,the clock can be analog or digital though a digital clock is highly preferred under both uscf and fide rulesets.,True,False,6.742530387181502
206,this is since most tournaments now include either an increment (extra time being added prior or after the move) or delay (a countdown to when a clock starts again) to their time controls.,True,False,6.384794976615758
207,"before the start of the game, either the arbiter decides, or whoever is playing black, where the chess clock is placed.",True,False,10.979587859046738
208,"== history ==
the rules of chess have evolved much over the centuries from the early chess-like games played in india in the 6th century.",True,False,7.6995156709192765
209,for much of that time the rules have varied from area to area.,True,True,22.881194275159103
210,"the modern rules first took form in italy during the 13th century, giving more mobility to pieces that previously had more restricted movement (such as the queen and bishop).",True,False,4.810483111785554
211,"such modified rules entered into an accepted form during the late 15th century (hooper & whyld 1992:41,328) or early 16th century (ruch 2004).",True,False,3.729307352364895
212,"the basic moves of the king, rook, and knight are unchanged.",True,False,16.36588534287044
213,pawns originally did not have the option of moving two squares on their first move and promoted only to a queen if they reached the eighth rank.,True,False,7.291098407659343
214,"the queen was originally the fers or farzin, which could move one square diagonally in any direction.",True,False,6.040873593255617
215,"in european chess it became able to leap two squares diagonally, forwards, backwards, or to left or right on its first move; some areas also gave this right to a newly promoted pawn.",True,False,4.396904314389811
216,"in the persian and arabic game the bishop was a pīl (persian) or fīl (arabic) (meaning ""elephant"") which moved two squares diagonally with jump (davidson 1949:13).",True,False,2.793057326078415
217,in the middle ages the pawn could only be promoted to the equivalent of a queen (which at that time was the weakest piece) if it reached its eighth rank (davidson 1949:59–61).,True,False,4.803885839297305
218,"during the 12th century the squares on the board sometimes alternated colors, and this became the standard in the 13th century (davidson 1949:146); whence the word ""chequered""/""checkered"".",True,False,4.934192832591437
219,between 1200 and 1600 several laws emerged that drastically altered the game.,True,False,6.013287727538627
220,checkmate became a requirement to win; a player could not win by capturing all of the opponent's pieces.,True,False,14.040165519294359
221,"stalemate was added, although the outcome has changed several times (see history of the stalemate rule).",True,False,10.154760611607594
222,"pawns gained the option of moving two squares on their first move, and the en passant rule was a natural consequence of that new option.",True,False,7.341613633925579
223,the king and rook acquired the right to castle (see variations throughout history of castling for different versions of the rule).,True,False,9.535753909043343
224,"between 1475 and 1500 the queen and the bishop also acquired their current moves, which made them much stronger pieces (davidson 1949:14–17).",True,False,5.919995782000047
225,when all of these changes were accepted the game was in essentially its modern form (davidson 1949:14–17).,True,False,4.907876219257721
226,the rules for pawn promotion have changed several times.,True,True,29.571085627589905
227,"as stated above, originally the pawn could only be promoted to the queen, which at that time was a weak piece.",True,False,10.852611329063782
228,"when the queen acquired its current move and became the most powerful piece, the pawn could then be promoted to a queen or a rook, bishop, or knight.",True,False,10.141747152494448
229,"in the 18th century rules allowed only the promotion to a piece already captured, e.g.",True,False,12.199080128492794
230,the rules published in 1749 by françois-andré danican philidor.,True,False,10.451960689562515
231,"in the 19th century this restriction was lifted, which allowed for a player to have more than one queen, e.g.",True,False,8.902694701467057
232,the 1828 rules by jacob sarratt (davidson 1949:59–61).,True,False,8.344468145805553
233,"two new rules concerning draws were introduced, each of which have changed through the years:

the threefold repetition rule was added, although at some times up to six repetitions have been required, and the exact conditions have been specified more clearly (see threefold repetition#history).",True,False,3.8912723271188248
234,the fifty-move rule was also added.,True,True,23.946585649017972
235,"at various times, the number of moves required was different, such as 24, 60, 70, or 75. for several years in the 20th century, the standard fifty moves was extended to one hundred moves for a few specific endgames (see fifty-move rule's history).another group of new laws included (1) the touch-move rule and the accompanying ""j'adoube/adjust"" rule; (2) that white moves first (in 1889); (3) the orientation of the board; (4) the procedure if an illegal move was made; (5) the procedure if the king had been left in check for some moves; and (6) issues regarding the behavior of players and spectators.",True,False,1.294812817411992
236,the staunton chess set was introduced in 1849 and it became the standard style of pieces.,True,False,10.296012664379052
237,"the size of pieces and squares of the board was standardized (hooper & whyld 1992:220–21, laws, history of).",True,False,8.455877110193505
238,"until the middle of the 19th century, chess games were played without any time limit.",True,False,14.727163853127779
239,"in an 1834 match between alexander mcdonnell and louis-charles mahé de la bourdonnais, mcdonnell took an inordinate amount of time to move, sometimes up to 1½ hours.",True,False,1.439481524077407
240,"in 1836 pierre charles fournier de saint-amant suggested a time limit, but no action was taken.",True,False,2.4990469456325997
241,"at the 1851 london tournament, staunton blamed his loss in his match against elijah williams  on williams' slow play; one game was adjourned for the day after only 29 moves.",True,False,2.1753385481455467
242,the next year a match between daniel harrwitz and johann löwenthal used a limit of 20 minutes per move.,True,False,2.6878762901933104
243,the first use of a modern-style time limit was in an 1861 match between adolph anderssen and ignác kolisch (sunnucks 1970:459).,True,False,2.334583126847863
244,"=== codification ===

the first known publication of chess rules was in a book by luis ramírez de lucena about 1497, shortly after the movement of the queen, bishop, and pawn were changed to their modern form (just 2014).",True,False,3.5471306263021503
245,ruy lópez de segura gave rules of chess in his 1561 book libro de la invencion liberal y arte del juego del axedrez (sunnucks 1970:294).,True,False,1.4929731112435232
246,"in the 16th and 17th centuries, there were local differences concerning rules such as castling, pawn promotion, stalemate, and en passant.",True,False,7.33303884169617
247,some of these differences persisted until the 19th century (harkness 1967:3); for example differences in castling rules persisted in italy until the late 19th century.,True,False,4.38615974285238
248,"as chess clubs arose and tournaments became common, there was a need to formalize the rules.",True,False,6.804524263870996
249,"in 1749 philidor (1726–1795) wrote a set of rules that were widely used, as well as rules by later writers such as the 1828 rules by jacob sarratt (1772–1819) and rules by george walker (1803–1879).",True,False,3.342862569840533
250,"in the 19th century, many major clubs published their own rules, including the hague in 1803, london in 1807, paris in 1836, and st. petersburg in 1854. in 1851 howard staunton (1810–1874) called for a ""constituent assembly for remodeling the laws of chess"" and proposals by tassilo von heydebrand und der lasa (1818–1889) were published in 1854. staunton had published rules in chess player's handbook in 1847, and his new proposals were published in 1860 in chess praxis; they were generally accepted in english-speaking countries.",True,False,1.1238197387882294
251,"german-speaking countries usually used the writings of chess authority johann berger (1845–1933) or handbuch des schachspiels by paul rudolf von bilguer (1815–1840), first published in 1843.
in 1924, fédération internationale des échecs (fide) was formed and in 1929 it took up the task of standardizing the rules.",True,False,1.149200931341961
252,"at first fide tried to establish a universal set of rules, but translations to various languages differed slightly.",True,False,4.892554052578665
253,"although fide rules were used for international competition under their control, some countries continued to use their own rules internally (hooper & whyld 1992:220–21).",True,False,7.312647001904164
254,in 1952 fide created the permanent commission for the rules of chess (also known as the rules commission) and published a new edition of the rules.,True,False,8.674878741029437
255,"the third official edition of the laws was published in 1966. the first three editions of the rules were published in french, with that as the official version.",True,False,6.890371200592308
256,in 1974 fide published the english version of the rules (which was based on an authorized 1955 translation).,True,False,5.136603097334453
257,"with that edition, english became the official language of the rules.",True,False,14.211217156478337
258,"another edition was published in 1979. throughout this time, ambiguities in the laws were handled by frequent interpretations that the rules commission published as supplements and amendments.",True,False,4.529485604501693
259,in 1982 the rules commission rewrote the laws to incorporate the interpretations and amendments (fide 1989:7–8).,True,False,5.805176084792173
260,"in 1984 fide abandoned the idea of a universal set of laws, although fide rules are the standard for high-level play (hooper & whyld 1992:220–21).",True,False,6.811349810413701
261,"with the 1984 edition, fide implemented a four-year moratorium between changes to the rules.",True,False,8.301476122815433
262,"other editions were issued in 1988 and 1992 (fide 1989:5), (just 2014).",True,False,7.658072954579927
263,"the rules of national fide affiliates (such as the united states chess federation, or uscf) are based on the fide rules, with slight variations (just 2014).",True,False,5.992751244743905
264,"kenneth harkness published popular rulebooks in the united states starting in 1956, and the uscf continues to publish rulebooks for use in tournaments it sanctions.",True,False,2.260805147110468
265,"in 2008, fide added the variant chess960 to the appendix of the ""laws of chess"".",True,False,10.537199371365304
266,"chess960 uses a random initial set-up of main pieces, with the conditions that the king is placed somewhere between the two rooks, and bishops on opposite-color squares.",True,False,6.619454107362284
267,"the castling rules are extended to cover all these positions.in the 21st century, rules about such things as mobile phones and unauthorised use of chess engines were introduced.",True,False,4.4538871098613875
268,"== variations ==
from time to time, rules have been introduced at certain tournaments to discourage players from agreeing to short draws.",True,False,8.386638735459211
269,"one such case was the ""no drawing or resigning during the first 30 moves"" rule used at the 2009 london chess classic.",True,False,5.312329806791998
270,"== see also ==

specific rules


== notes ==


== references ==
burgess, graham (2009), the mammoth book of chess (3rd ed.",True,False,3.994124899813277
271,"), running press, isbn 978-0-7624-3726-9
davidson, henry (1949), a short history of chess (1981 ed.",True,False,4.892550000886034
272,"), mckay, isbn 0-679-14550-8
fide (1989), the official laws of chess, macmillan, isbn 0-02-028540-x
fide (2008), fide laws of chess, fide, isbn 978-0-9594355-2-8, retrieved 2008-09-10
harkness, kenneth (1967), official chess handbook, mckay
hooper, david; whyld, kenneth (1996) [first pub.",True,False,2.495462506619669
273,"1992], the oxford companion to chess (2nd ed.",True,False,6.080903170344447
274,"), oxford university press, isbn 0-19-280049-3
just, tim (2014), u.s. chess federation's official rules of chess (6th ed.",True,False,4.834635452718924
275,"), mckay, isbn 978-0-8129-3559-2
polgar, susan; truong, paul (2005), a world champion's guide to chess, random house, isbn 978-0-8129-3653-7
reinfeld, fred (1954), how to be a winner at chess, fawcett, isbn 0-449-91206-x
ruch, eric (2004), the italian rules, iccf, retrieved 2008-09-10
schiller, eric (2003), official rules of chess (2nd ed.",True,False,1.5065374081272682
276,"), cardoza, isbn 978-1-58042-092-1
staunton, howard (1847), the chess-player's handbook, london: h. g. bohn, pp.",True,False,2.6070391805802133
277,"21–22, isbn 0-7134-5056-8 (1985 batsford reprint, isbn 1-85958-005-x)
sunnucks, anne (1970), the encyclopaedia of chess, st. martin's press (2nd ed.",True,False,2.5511162477374696
278,"), isbn 978-0-7091-4697-1
timman, jan (2005), curaçao 1962: the battle of minds that shook the chess world, new in chess, isbn 978-90-5691-139-3


== further reading ==
golombek, harry, ed.",True,False,2.929554933759072
279,"(1976), the laws of chess and their interpretations, pitman, isbn 0-273-00119-1
golombek, harry (1977), golombek's encyclopedia of chess, crown publishing, isbn 0-517-53146-1
harkness, kenneth (1970), official chess rulebook, mckay, isbn 0-679-13028-4


== external links ==
fide laws of chess
fide standards of chess equipment, venue for fide tournaments, rate of play and tie-break regulations
uscf learn to play chess
uscf clock rules",True,False,1.9143932495088805
280,the grand mansion gate (chinese: 大宅门) is a 2001 chinese historical television series written and directed by guo baochang.,False,False,0.0
281,guo is also the author of the original novel of the same name.,False,False,0.0
282,"the television series stars siqin gaowa, chen baoguo, liu peiqi, du yulu, he saifei, jiang wenli, and zhang fengyi.",False,False,0.0
283,prominent chinese directors zhang yimou and chen kaige also make cameo appearances.,False,False,1.4278080728318956
284,guo baochang spent over 40 years writing the script for film.,False,False,1.4921846645218986
285,"guo had sole discretion with the early script, and eventually wrote approximately 4 drafts.",False,False,0.0
286,"the television series began production in 2000 and finished filming in 2001. a second season was completed in 2003.
the grand mansion gate details the story of the rise and fall of the time-honored brand baicao hall and the frustrations and fates of three generations of the bai family.the series premiered on cctv-1 in mainland china on 15 april 2001 and in hong kong on june 4.",False,False,0.07814451797084296
287,"== synopsis ==
in 1880 during the 6th year of the guangxu period of the qing dynasty, bai jingqi (chen baoguo) is born into the baicao hall, a prominent merchant family in beijing.",False,False,0.0
288,the first season chronicles the lives of bai jingqi's predecessors in the late qing and early republic of china before focusing on bai jingqi when he becomes the new family patriarch.,False,False,1.0327659609788906
289,the subsequent season details his later life after the second sino-japanese war through to the establishment of the people's republic of china.,False,False,1.0276459486453564
290,"== cast ==


=== main ===
chen baoguo as bai jingqi (白景琦), liu cihang and wang cihang portray bai jingqi as a child.the series' main protagonist, patriarch and head of the baicao hall.",False,False,0.0
291,"born to bai yingxuan and his wife wen shi, jingqi never once cried in his childhood years, and was branded by his uncle bai yingyu as an unlucky omen.",False,False,0.0
292,he succeeded his mother as the head of the baicao hall.,False,False,0.0
293,"notoriously hot-tempered, jingqi maintains a strict grip on the family and its influence as years of revolution and instability plaguing china in the late 19th to mid-20th century tests the prestige of his time-honored family name.he saifei as yang jiuhong (杨九红).one of bai jingqi's concubines, who was formerly a prostitute.",False,False,0.3507788484669074
294,"yang's status as a former prostitute results in years of disdain and abuse by the bai family, notably from jingqi's mother, bai wen shi.",False,False,1.488187301158905
295,"the series marks the second time he and zhang yimou are working together, having worked together ten years prior on the set of his film raise the red lantern, where she played a similar character of low-social status struggling against members of a wealthy household.xie lan as li xiangxiu (李香秀).bai jingqi's second wife, originally a servant girl sold to the bai family by her parents.",False,False,0.41919268537594634
296,"her years as a servant girl allowed her to see the bitter rivalries surrounding jingqi and his concubines, which she uses to her advantage.",False,False,0.0
297,"she begins an affair with bai jingqi and uses his favor to maneuver her way into becoming his second wife, thus granting her a higher title and status, notably over yang jiuhong, whose relentless bullying and abuse of another concubine resulted in the latter committing suicide.siqin gaowa as mrs. bai (bai wen shi) (白文氏).bai jingqi's mother and his predecessor as head of the bai family.",False,False,0.10751187234469083
298,"her role was aggressively challenged by wealthy patriarchs, including her own brother-in-law bai yingyu, but upon successfully defending the family's secret medicinal formula from scheming entrepreneurs, she became the unquestioned matriarch of the baicao hall.",False,False,0.5088319334116849
299,"she maintained the assets, wealth and prestige of the family, amassing influence by currying favor with imperial eunuchs of the qing court, and outmaneuvering members of the manchu nobility.liu peiqi as bai yingyu (白颖宇).bai jingqi's uncle, spoiled in his childhood by his mother and overprotected in adulthood by his eldest brother, bai yingyu was a thrifty spender who rarely cared about the devastating effects brought to the bai family.",False,False,0.08041538419277687
300,"he became an entrepreneur, sponsoring brothels and fought bitterly against his sister-in-law wen shi, plotting to steal the family's secret medicinal formula to drive the baicao hall out of business, and taking her son jingqi to a brothel when he was a child.",False,False,0.24498061314455866
301,"=== the bai family ===
du yulu as bai mengtang (白萌堂), bai jingqi's paternal grandfather, the head of the baicao hall at the start of the series.",False,False,0.7691389977931976
302,"wang liyuan as mrs. bai (bai zhou shi) (白周氏), bai jingqi's paternal grandmother.",False,False,0.8991902050646868
303,"li hongtao as bai yingyuan (白颖园), bai mengtang's eldest son.",False,False,1.4929950574658952
304,"zhao lingqi as mrs. bai (bai yin shi) (白殷氏), bai yingyuan's wife.",False,False,1.0550498406092326
305,"bi yanjun as bai yingxuan (白颖轩), bai mengtang's second son and bai jingqi's father.",False,False,1.566905703875098
306,"liu peiqi as bai yingyu (白颖宇), bai mengtang's youngest son.",False,False,1.4929950574658952
307,"zhang yan as mrs. bai (bai fang shi) (白方氏), bai yingyu's wife.",False,False,1.0550498406092326
