,user_doc,type,predict,score
308,"li ping as bai yaping (白雅萍), bai mengtang's youngest child and only daughter.",False,False,1.2363865319639444
309,"jia xinguang as bai jingyi (白景怡), bai yingyuan's eldest son.",False,False,1.4929950574658952
310,"shang ying as wu cuigu (乌翠姑), bai jingyi's wife.",False,False,1.7983804101293737
311,xu boping as young bai jingyi.,False,False,0.0
312,"cheng xiangyin as bai jingshuang (白景双), bai yingyu's eldest son.",False,False,1.4929950574658952
313,"ai liya as bai yufen (白玉芬), bai yingyuan's daughter.",False,False,1.8402032103649406
314,geng sisi as young bai yufen.,False,False,0.0
315,"li shusheng as bai jingsi (白景泗), bai yingyuan's second son.",False,False,1.4929950574658952
316,wu jianing as young bai jingsi.,False,False,0.0
317,"liu chao as bai jingwu (白景武), bai yingyu's second son.",False,False,1.4929950574658952
318,wang chaoqun as young bai jingwu.,False,False,0.0
319,"li xiaolei as bai jinglu (白景陆), bai yingyuan's third son.",False,False,1.8402032103649406
320,chen weiyou as young bai jinglu.,False,False,0.0
321,"ru ping as huang chun (黄春), bai jingqi's wife.",False,False,1.7983804101293737
322,chen lingyue as young huang chun.,False,False,0.0
323,"lei juan as huai hua (槐花), bai jingqi's second concubine and a former servant girl.",False,False,1.0276459486453564
324,"jiang wenli as bai yuting (白玉婷), bai yingxuan's youngest daughter.",False,False,1.4929950574658952
325,ma sichun as young bai yuting.,False,False,0.0
326,"ji baozhong as bai jingsheng (白敬生), bai jingyi's eldest son.",False,False,1.4929950574658952
327,"zhao yi as bai jingye (白敬业), bai jingqi and huang chun's eldest son.",False,False,1.0411676058643742
328,"zhang yang as bai jinggong (白敬功), bai jingqi and huang chun's second son.",False,False,1.0411676058643742
329,"zhang dinghan as bai jiali (白佳莉), bai jingqi and yang jiuhong's daughter.",False,False,1.2363865319639444
330,"liu lingzhi as bai zhanyuan (白占元), bai jingqi's grandson and bai jingye's eldest son.",False,False,1.566905703875098
331,"=== supporting ===
zhang fengyi as ji zengbu (季宗布), bai jingqi's teacher and a military officer in the royal guard divine engine division.",False,False,0.5205838029321871
332,"zheng had worked alongside many of the main and supporting cast members, notably siqin gaowa and chen kaige.",False,False,0.0
333,yu rongguang as bai hua.,False,False,0.0
334,"li xuejian as master yu (于八爷), a drug dealer in beijing.",False,False,0.0
335,"lei kesheng as wang xiguang (王喜光), an imperial eunuch.",False,False,0.0
336,yuan zi as young wang xiguang.,False,False,0.0
337,"ning jing as zhen'er (珍儿), madam of the brothel yang jiuhong worked at.",False,False,0.0
338,"zhang yimou as li lianying, an imperial eunuch of the empress dowager.",False,False,0.0
339,chen kaige as an official in the local government.,False,False,1.6659418493509293
340,"he qun as pitou'er (皮头儿), a worker at a pawnshop.",False,False,0.0
341,"tian zhuangzhuang as taki (田木), a japanese military officer.",False,False,0.0
342,"== production ==


=== conception and development ===
in 1959 at the age of 19, guo baochang entered beijing film academy and began to write the novel the grand mansion gate.",False,False,0.0
343,"at the dawn of the cultural revolution, he was labeled as a ""reactionary student"" and was sent to nankou farm of beijing to reform through labor.",False,False,0.0
344,"in order to avoid the attention of the red guards, he burned the original manuscript.",False,False,0.0
345,in march 1969 he rewrote the novel.,False,False,0.0
346,in 1980 he divorced his wife and the novel was burned by the furious woman.,False,False,0.0
347,"at the end of 1994, he rewrote the novel for the third and final time.baicao hall (百草厅) took inspiration from tong ren tang, one of the time-honored pharmaceutical companies in china founded at the beginning of the qing dynasty and which has lasted for almost 350 years.",False,False,0.18862796268335552
348,guo baochang himself had lived there for more than 26 years.,False,False,0.0
349,"the main character bai jingqi was inspired by yue jingyu (乐镜宇), guo baochang's foster father and founder of the hong ji tang pharmaceutical company.",False,False,0.37860640213249974
350,"the characters bai yuting and li xiangxiu were inspired by guo's twelfth aunt and a concubine of yue jingyu's, respectively.",False,False,1.3411650516219058
351,"=== casting ===
directors zhang yimou, chen kaige, he qun and tian zhuangzhuang joined the cast.",False,False,0.0
352,"actors yu rongguang, li xuejian, ning jing and lei kesheng were cast in supporting roles for the series.",False,False,0.0
353,"=== filming ===
principal photography started in 2000 and wrapped in 2001.",False,False,0.0
354,"== music ==


== broadcast ==
the grand mansion gate was broadcast in mainland china in april 2001 and two months later was aired in hong kong.",False,False,0.0
355,"== references ==


== external links ==
the grand mansion gate on imdb
the grand mansion gate at douban (in chinese)
the grand mansion gate at the mtime.com (in chinese)",False,False,0.0
